<?xml version="1.0" encoding="utf-8"?>
<!DOCTYPE Flight SYSTEM "Flights.dtd">
<Flight>
  <FlightID>1</FlightID>
  <Date>8.6.2014</Date>
  <FlightNumber>A345</FlightNumber>
  <DepTime>12:45</DepTime>
  <ArrvTime>14:30</ArrvTime>
  <Status>излетял</Status>
  <GroundOp></GroundOp>
  <Airline>
    <AirlineID>1</AirlineID>
    <Name>БългарияЕър</Name>
    <AirlineCountry>България</AirlineCountry>
    <Phone>089898989</Phone>
    <Website OnlineCheckIN="не" HotelBooking="не" CarRental="не" />
  </Airline>
  <Aircraft Type="А320" Capacity="350" Engines="2">
    <AircraftID>1</AircraftID>
    <Description>Самолет за къси разстояния.</Description>
    <FirstDate>12.12.1996</FirstDate>
    <Length>39.50</Length>
    <Height>12</Height>
    <Wingspan>8.7</Wingspan>
    <Diameter>Самолет за къси разстояния.</Diameter>
    <Speed>996.7</Speed>
    <Manufacturer>Холандия</Manufacturer>
  </Aircraft>
  <AirportInfo Airport="излитане">
    <AirportID>1</AirportID>
    <Code>SOF</Code>
    <AirportPhone Type="мобилен" Fax="не">089898989</AirportPhone>
    <Address>
      <City>София</City>
      <Street>Христофор Колумб</Street>
      <Postalcode>1000</Postalcode>
      <AirportWebsite>www.sofia-airport.bg/</AirportWebsite>
    </Address>
  </AirportInfo>
  <AirportInfo Airport="кацане">
    <AirportID>2</AirportID>
    <Code>ATL</Code>
    <AirportPhone Type="стационарен" Fax="да">012003000</AirportPhone>
    <Address>
      <City>Атланта</City>
      <Street></Street>
      <Postalcode></Postalcode>
      <AirportWebsite>www.atlanta-airport.com</AirportWebsite>
    </Address>
  </AirportInfo>
  <Member Position="пилот">
    <MemberID>1</MemberID>
    <MemberName>Димитър Иванов</MemberName>
    <Country>България</Country>
    <Age>45</Age>
    <Years>20</Years>
  </Member>
</Flight>