<?xml version="1.0" encoding="utf-8"?>
<!DOCTYPE Flight SYSTEM "Flights.dtd">
<Flight>
  <FlightID>123</FlightID>
  <Date>123</Date>
  <DepTime>123</DepTime>
  <ArrvTime>123</ArrvTime>
  <GroundOp>123</GroundOp>
  <Airline>
    <AirlineID>123</AirlineID>
    <Name>123</Name>
    <AirlineCountry>123</AirlineCountry>
    <Phone>123</Phone>
    <Website OnlineCheckIN="не" HotelBooking="да" CarRental="не" />
  </Airline>
  <Aircraft Type="123" Capacity="123" Engines="123">
    <AircraftID>123</AircraftID>
    <Description></Description>
    <FirstDate></FirstDate>
    <Length></Length>
    <Height></Height>
    <Wingspan></Wingspan>
    <Diameter></Diameter>
    <Speed></Speed>
    <Manufacturer></Manufacturer>
  </Aircraft>
  <AirportInfo Airport="кацане">
    <AirportID>123</AirportID>
    <Code>123</Code>
    <AirportPhone Type="" Fax="не"></AirportPhone>
    <Address>
      <City></City>
      <Street></Street>
      <Postalcode></Postalcode>
      <AirportWebsite></AirportWebsite>
    </Address>
  </AirportInfo>
  <AirportInfo Airport="излитане">
    <AirportID>321</AirportID>
    <Code>321</Code>
    <AirportPhone Type="" Fax="не"></AirportPhone>
    <Address>
      <City></City>
      <Street></Street>
      <Postalcode></Postalcode>
      <AirportWebsite></AirportWebsite>
    </Address>
  </AirportInfo>
  <Member MemberID="33">
    <MemberName>33333</MemberName>
    <Country></Country>
    <Age></Age>
    <Years></Years>
  </Member>
</Flight>